<?xml version='1.0' standalone='no'?>
<!DOCTYPE source_library SYSTEM "A1_Sources.dtd" >
<source_library title="prototype sources" 
                function_library="$(LIKELIHOODXMLPATH)/A1_Functions.xml">
   <source name="Bright Point Source" type="PointSource">
      <spectrum type="Bright Source Power-law"></spectrum>
      <spatialModel type="SkyDirFunction">
         <parameter name="RA"
                    value="0"
                    min="-180"
                    max="180"
                    free="false"
                    scale="1"/>
         <parameter name="DEC"
                    value="0"
                    min="-90"
                    max="90"
                    free="false"
                    scale="1"/>
      </spatialModel>
   </source>

   <source name="Galactic Diffuse Emission" type="DiffuseSource">
      <spectrum type="Galactic Diffuse Power-law"></spectrum>
      <spatialModel type="SpatialMap" 
                    file="$(EXTFILESSYS)/galdiffuse/EGRET_diffuse_cel.fits">
      </spatialModel>
   </source>

   <source name="Extragalactic Diffuse Emission" type="DiffuseSource">
      <spectrum type="Extragalactic Diffuse Power-law"></spectrum>
      <spatialModel type="ConstantValue">
         <parameter name="Value"
                    value="1"
                    min="0"
                    max="10"
                    free="false"
                    scale="1"/>
      </spatialModel>
   </source>
</source_library>
