<?xml version="1.0" ?>
<!DOCTYPE source_library
  SYSTEM '$(LIKELIHOODROOT)/xml/A1_Sources.dtd'>
<source_library title="source library">
    <source name="Crab Pulsar" type="PointSource">
      <spectrum type="PowerLaw">
        <parameter free="1" max="1000.0" min="0.001" name="Prefactor" scale="1e-09" value="27.0"/>
        <parameter free="1" max="-1.0" min="-3.5" name="Index" scale="1.0" value="-2.19"/>
        <parameter free="0" max="2000.0" min="30.0" name="Scale" scale="1.0" value="100.0"/>
      </spectrum>
      <spatialModel type="SkyDirFunction">
        <parameter free="0" max="3.40282e+38" min="-3.40282e+38" name="RA" scale="1.0" value="83.57"/>
        <parameter free="0" max="3.40282e+38" min="-3.40282e+38" name="DEC" scale="1.0" value="22.01"/>
      </spatialModel>
    </source>
  </source_library>
