<?xml version="1.0" standalone="no"?>
<!DOCTYPE source_library SYSTEM "$(LIKELIHOODXMLPATH)/A1_Sources.dtd" >
<source_library title="source library">
<source name="Crab Pulsar" type="PointSource">
    <spectrum type="PowerLaw">
      <parameter free="1" max="1000" min="0.001" name="Prefactor" scale="1e-09" value="27"/>
      <parameter free="1" max="-1" min="-3.5" name="Index" scale="1" value="-2.19"/>
      <parameter free="0" max="2000" min="30" name="Scale" scale="1" value="100"/>
    </spectrum>
    <spatialModel type="SkyDirFunction">
      <parameter free="0" max="3.40282e+38" min="-3.40282e+38" name="RA" scale="1" value="83.57"/>
      <parameter free="0" max="3.40282e+38" min="-3.40282e+38" name="DEC" scale="1" value="22.01"/>
    </spatialModel>
  </source>
<source name="Geminga" type="PointSource">
    <spectrum type="PowerLaw">
      <parameter free="1" max="1000" min="0.001" name="Prefactor" scale="1e-09" value="23.29"/>
      <parameter free="1" max="-1" min="-3.5" name="Index" scale="1" value="-1.66"/>
      <parameter free="0" max="2000" min="30" name="Scale" scale="1" value="100"/>
    </spectrum>
    <spatialModel type="SkyDirFunction">
      <parameter free="0" max="3.40282e+38" min="-3.40282e+38" name="RA" scale="1" value="98.49"/>
      <parameter free="0" max="3.40282e+38" min="-3.40282e+38" name="DEC" scale="1" value="17.86"/>
    </spatialModel>
  </source>
</source_library>
