<?xml version="1.0" standalone="no"?>
<!DOCTYPE source_library SYSTEM "$(LIKELIHOODXMLPATH)/A1_Sources.dtd" >
<source_library title="source library">
<source name="Extragalactic Diffuse" type="DiffuseSource">
    <spectrum type="PowerLaw">
      <parameter free="1" max="100" min="1e-05" name="Prefactor" scale="1e-07" value="1.32"/>
      <parameter free="0" max="-1" min="-3.5" name="Index" scale="1" value="-2.1"/>
      <parameter free="0" max="200" min="50" name="Scale" scale="1" value="100"/>
    </spectrum>
    <spatialModel type="ConstantValue">
       <parameter free="0" max="10" min="0" name="Value" scale="1" value="1"/>
    </spatialModel>
  </source>
<source name="Galactic Diffuse" type="DiffuseSource">
    <spectrum type="PowerLaw">
      <parameter free="1" max="1000" min="0.001" name="Prefactor" scale="0.001" value="11"/>
      <parameter free="0" max="-1" min="-3.5" name="Index" scale="1" value="-2.1"/>
      <parameter free="0" max="200" min="50" name="Scale" scale="1" value="100"/>
    </spectrum>
    <spatialModel file="$(EXTFILESSYS)/galdiffuse/EGRET_diffuse_cel.fits" type="SpatialMap">
      <parameter free="0" max="1000" min="0.001" name="Prefactor" scale="1" value="1"/>
    </spatialModel>
  </source>
<source name="PKS 0528+134" type="PointSource">
    <spectrum type="PowerLaw">
      <parameter free="1" max="1000" min="0.001" name="Prefactor" scale="1e-09" value="13.65"/>
      <parameter free="1" max="-1" min="-3.5" name="Index" scale="1" value="-2.46"/>
      <parameter free="0" max="2000" min="30" name="Scale" scale="1" value="100"/>
    </spectrum>
    <spatialModel type="SkyDirFunction">
      <parameter free="0" max="3.40282e+38" min="-3.40282e+38" name="RA" scale="1" value="82.74"/>
      <parameter free="0" max="3.40282e+38" min="-3.40282e+38" name="DEC" scale="1" value="13.38"/>
    </spatialModel>
  </source>
<source name="Crab Pulsar" type="PointSource">
    <spectrum type="BrokenPowerLaw">
      <parameter free="1" max="1000" min="0.001" name="Prefactor" scale="1e-09" value="27"/>
      <parameter free="1" max="-1" min="-5." name="Index1" scale="1" value="-2.19"/>
      <parameter free="1" max="-1" min="-6." name="Index2" scale="1" value="-4.89"/>
      <parameter free="0" max="10000" min="30" name="BreakValue" scale="1" value="1500"/>
    </spectrum>
    <spatialModel type="SkyDirFunction">
      <parameter free="0" max="3.40282e+38" min="-3.40282e+38" name="RA" scale="1" value="83.57"/>
      <parameter free="0" max="3.40282e+38" min="-3.40282e+38" name="DEC" scale="1" value="22.01"/>
    </spatialModel>
  </source>
<source name="Geminga" type="PointSource">
    <spectrum type="BrokenPowerLaw">
      <parameter free="1" max="1000" min="0.001" name="Prefactor" scale="1e-09" value="23.29"/>
      <parameter free="1" max="-1" min="-5" name="Index1" scale="1" value="-1.66"/>
      <parameter free="1" max="-1" min="-5" name="Index2" scale="1" value="-3.1"/>
      <parameter free="0" max="10000" min="30" name="BreakValue" scale="1" value="2000"/>
    </spectrum>
    <spatialModel type="SkyDirFunction">
      <parameter free="0" max="3.40282e+38" min="-3.40282e+38" name="RA" scale="1" value="98.49"/>
      <parameter free="0" max="3.40282e+38" min="-3.40282e+38" name="DEC" scale="1" value="17.86"/>
    </spatialModel>
  </source>
</source_library>
